Keyword,Origin
generative ai intensive course,new
generative ai leader certification course,new
generative ai leader course,new
generative ai leader google course,new
generative ai leadership course,new
generative ai leadership course google,new
generative ai learning course,new
generative ai learning courses,new
generative ai learning courses online,new
generative ai learning path course,new
generative ai learning path google course,new
generative ai linkedin course,new
generative ai llm course,new
generative ai marketing course,new
generative ai mastermind course,new
generative ai mastery course,new
generative ai microsoft course,new
generative ai microsoft free course,new
generative ai mit course,new
generative ai modeling course,new
generative ai nvidia course,new
generative ai nvidia free course,new
generative ai offline course,new
generative ai on aws course,new
generative ai overview for project managers course,new
generative ai product management course,new
generative ai product manager course,new
generative ai productivity hacks with miss excel course,new
generative ai professional course,new
generative ai programming course,new
generative ai projects courses,new
generative ai prompt engineering course,new
generative ai python course,new
generative ai recruiting and talent acquisition course,new
generative ai refresher course,new
generative ai refresher course answers,new
generative ai related certifications and courses,new
generative ai sap course,new
generative ai security course,new
generative ai seo course,new
generative ai short course,new
generative ai short courses,new
generative ai software testing course,new
generative ai specialist course,new
generative ai specialization course,new
generative ai specialization courses,new
generative ai sql analysis course coursera,new
generative ai sql data analysis course,new
generative ai strategy course,new
generative ai supply chain course,new
generative ai testing course,new
generative ai tools certification course,new
generative ai tools course,new
generative ai tools for productivity and research course,new
generative ai tools online course,new
generative ai top courses,new
generative ai training course in hyderabad,new
generative ai training courses,new
generative ai udemy course,new
generative ai university course,new
generative ai with large language models course,new
generative ai with llms course,new
generative ai with llms course by aws and deeplearning ai,new
generative ai with python course,new
generative and agentic ai course,new
george mount enhancing excel with generative ai tools course,new
get ready for generative ai course,new
good generative ai courses,new
google ai course free generative ai,new
google ai course generative,new
google ai courses generative ai,new
google ai generative course,new
google ai generative courses,new
google cloud ai generative course,new
google cloud courses generative ai,new
google cloud generative ai course,new
google cloud generative ai course cost,new
google cloud generative ai course online,new
google cloud generative ai for business professionals course,new
google cloud introduction to generative ai course,new
google course for generative ai,new
google course generative ai,new
google course generative ai certification,new
google course introduction to generative ai,new
google course on generative ai,new
google courses generative ai,new
google courses introduction to generative ai,new
google courses on generative ai,new
google free certification courses generative ai,new
google free course introduction to generative ai,new
google free course on generative ai,new
google free courses generative ai,new
google free courses on generative ai,new
google free generative ai certification course,new
google free generative ai course,new
google free generative ai course for beginners,new
google free generative ai courses,new
google generated ai course,new
google generative ai 5 day course,new
google generative ai course answers,new
google generative ai course bundle,new
google generative ai course certificate,new
google generative ai course certificate cost,new
google generative ai course certificate online,new
google generative ai course coursera,new
google generative ai course free,new
google generative ai course free with certificate,new
google generative ai course learning path,new
google generative ai course learning path free,new
google generative ai course march 31,new
google generative ai course online,new
google generative ai course online free,new
google generative ai course review,new
google generative ai courses,new
google generative ai courses free,new
google generative ai courses online,new
google generative ai free certification course,new
google generative ai free course,new
google generative ai free courses,new
google generative ai leader course,new
google generative ai learning course,new
google generative ai studio course,new
google introduction to generative ai course,new
google just released 10 free courses to master generative ai,new
google launches free generative ai courses,new
google learning path generative ai course free,new
google new generative ai course,new
google's generative ai course,new
great learning generative ai course,new
great learning generative ai course fee,new
great learning generative ai course free download,new
harvard generative ai course,new
harvard generative ai free course,new
harvard generative ai online course,new
how to choose a generative ai course,new
how to choose an applied generative ai course,new
how to choose the right applied generative ai course,new
how to choose the right generative ai course,new
how to choose the right generative ai courses,new
how to generate course content with ai,new
hugging face generative ai course,new
ibm free generative ai course,new
ibm generative ai course,new
ibm generative ai course free,new
ibm generative ai courses,new
ibm generative ai engineering course,new
ibm generative ai for cybersecurity professionals free courses,new
ibm generative ai free course,new
ibm generative ai prompt engineering basics course,new
iisc generative ai course,new
iit generative ai course,new
iit guwahati generative ai course,new
iit madras generative ai course,new
iit patna generative ai course,new
iit roorkee generative ai course,new
image generator ai course,new
ineuron generative ai course,new
integrating generative ai into the creative process course,new
integrating generative ai into the creative process online course,new
intellipaat generative ai course,new
intro to generative ai course,new
introduction to generative ai course,new
introduction to generative ai course by google,new
introduction to generative ai course by simplilearn,new
introduction to generative ai course google,new
introduction to generative ai free course,new
introduction to generative ai free course with certificate,new
introduction to generative ai fundamental course,new
introduction to generative ai google course,new
introduction to generative ai google course free,new
introduction to generative ai google free course,new
introduction to generative ai with gpt course,new
introduction to prompt engineering for generative ai 2023 course,new
introduction to prompt engineering for generative ai course,new
introduction to prompt engineering for generative ai online course,new
is google generative ai course worth it,new
isb generative ai course,new
isb generative ai course hyderabad,new
john hopkins generative ai course,new
johns hopkins generative ai course,new
katrina ingram using generative ai ethically at work course,new
learn generative ai course,new
linkedin amplify your personal brand with generative ai course,new
linkedin discover the possibilities of generative ai course,new
linkedin elevate your business branding with generative ai course,new
linkedin generative ai and workplace transformation course,new
linkedin generative ai course,new
linkedin generative ai course answers,new
linkedin generative ai for product managers course,new
linkedin generative ai training course,new
linkedin introduction to prompt engineering for generative ai 2023 course,new
linkedin introduction to prompt engineering for generative ai course,new
linkedin leveraging generative ai for project management course,new
linkedin leveraging generative ai in finance and accounting course,new
linkedin rapid idea generation using ai course,new
linkedin using chatgpt and generative ai in fintech course,new
linkedin weekly generative ai tool series course,new
llm and generative ai course,new
llm generative ai course,new
lms ai course generator basic outline,new
lms ai course generator build content from outline,new
london business school generative ai course,new
machine learning and generative ai course,new
master generative ai course,new
mastering generative ai course,new
mastering generative ai tools course,new
microsoft ai generative course,new
microsoft and linkedin generative ai free course,new
microsoft announces generative ai skill training course for free,new
microsoft course on generative ai,new
microsoft free generative ai course,new
microsoft generative ai course,new
microsoft generative ai course 18 lessons,new
microsoft generative ai course cost,new
microsoft generative ai course for beginners,new
microsoft generative ai course free,new
microsoft generative ai course free pdf,new
microsoft generative ai course github,new
microsoft generative ai course linkedin,new
microsoft generative ai course online free,new
microsoft generative ai courses,new
microsoft generative ai courses for beginners free,new
microsoft generative ai courses for beginners online,new
microsoft generative ai courses for beginners pdf,new
microsoft generative ai for beginners course content,new
microsoft generative ai for beginners course link,new
microsoft generative ai free course,new
microsoft generative ai free course with certificate,new
microsoft generative ai free course with certificate online,new
microsoft generative ai skill training course,new
microsoft linkedin generative ai course,new
mini course ai generate and sell one platform,new
mini course generator ai,new
mini course generator with ai assistant,new
mit course generative ai,new
mit generative ai course cost,new
mit generative ai course free,new
mit generative ai course pdf,new
mit generative ai course review,new
mit generative ai courses,new
morgan young amplify your personal brand with generative ai course,new
most popular generative ai courses 2025,new
mti generative ai course,new
nvidia ai generative course,new
nvidia course generative ai,new
nvidia courses generative ai,new
nvidia deep learning institute generative ai courses,new
nvidia deep learning institute generative ai courses 2025,new
nvidia free ai courses generative ai,new
nvidia free courses generative ai,new
nvidia free generative ai course,new
nvidia generative ai course,new
nvidia generative ai course certificate,new
nvidia generative ai course free,new
nvidia generative ai courses,new
nvidia generative ai explained course,new
nvidia generative ai explained course answers,new
nvidia generative ai free course,new
oci 2024 generative ai professional certification and course,new
oci generative ai course,new
oci generative ai professional course,new
offering courses generative ai,new
offering free courses generative ai,new
online course ai video generation,new
online course generator ai free,new
online course on generative ai,new
online courses for generative ai,new
online courses generative ai,new
online courses on generative ai,new
online discover the possibilities of generative ai course,new
online enhancing excel with generative ai tools course,new
online ethics in the age of generative ai course,new
online generative ai courses,new
online generative ai courses universities,new
online generative ai for business leaders course,new
online integrating generative ai into the creative process course,new
online introduction to prompt engineering for generative ai course,new
online using generative ai ethically at work course,new
online weekly generative ai tool series course,new
open ai generative ai course,new
openai generative ai course,new
oracle generative ai course,new
oxford generative ai course,new
pmi generative ai course,new
pmi generative ai course cost,new
pmi generative ai course duration,new
pmi generative ai overview for project managers course,new
practical application tips for generative ai with comfyui course,new
practical generative ai courses,new
professional certificate course in data analytics and generative ai,new
professional certificate course in generative ai and machine learning,new
prompt engineering course for generative ai,new
prompt engineering course with generative ai,new
purdue generative ai course,new
purdue generative ai course review,new
python and generative ai beginner's course,new
python for generative ai course,new
python generative ai course,new
ronnie sheer introduction to prompt engineering for generative ai course,new
sap generative ai course,new
sap generative ai course cost,new
servicenow generative ai course,new
simplilearn applied generative ai course,new
simplilearn generative ai course,new
simplilearn generative ai course review,new
simplilearn generative ai free course,new
smu generative ai course,new
snowflake generative ai course,new
stanford generative ai free course,new
teaching with generative ai in higher education course,new
top applied generative ai course,new
top applied generative ai course in india,new
top applied generative ai course in us,new
top applied generative ai course online,new
top courses for generative ai,new
top courses on generative ai,new
top data analytics and generative ai course,new
top data analytics and generative ai course online,new
top data science and generative ai course in us,new
top generative ai and machine learning course,new
top generative ai and machine learning course in us,new
top generative ai courses,new
top generative ai courses 2024,new
top generative ai courses 2025,new
top generative ai courses for beginners,new
top generative ai courses in the us 2025,new
top generative ai courses online,new
top generative ai courses online 2025,new
top online courses for careers in generative ai 2025,new
top online generative ai courses 2025,new
trendytech generative ai course,new
trust insights releases generative ai for marketers course,new
udacity generative ai course,new
udacity generative ai course free download,new
udacity generative ai course reviews,new
udemy ai generative course buy,new
udemy ai generative course buy bring your laptop,new
udemy course on generative ai,new
udemy courses on generative ai,new
udemy generative ai course,new
udemy generative ai courses,new
university course ai generator,new
university of michigan generative ai course,new
university of texas generative ai courses 2025 online,new
upgrad generative ai course cost,new
upgrad generative ai course review,new
vaibhav sisinty generative ai course,new
vilas dhar ethics in the age of generative ai course,new
watch enhancing excel with generative ai tools course,new
watch ethics in the age of generative ai course,new
watch generative ai in hr course,new
watch introduction to generative ai with gpt course,new
watch introduction to prompt engineering for generative ai course,new
watch leveraging generative ai for project management course,new
what are the most popular generative ai courses,new
what is generative ai course,new
whats a good introductory course to generative ai,new
whats the top course of generative ai fundamentals specialization 2024,new
which generative ai course is best,new
wsq generative ai course,new
youtube generative ai course,new
ai certificate programs,existing
ai certification classes,existing
ai certification cost,existing
ai certification courses,existing
ai certification mit,existing
ai class,existing
ai course for business leaders,existing
ai courses for executives,existing
ai courses near me,existing
ai diploma,existing
ai executive education,existing
ai for business,existing
ai for business leaders,existing
ai for engineering,existing
ai for engineers,existing
ai for enterprise,existing
ai for executives,existing
ai for executives course,existing
ai for managers course,existing
ai for product managers,existing
ai generated courses,existing
ai graphic design course,existing
ai innovation course,existing
ai learning course,existing
ai online courses,existing
ai prompt engineering course,existing
ai related certifications,existing
ai short course,existing
ai strategy course,existing
ai upskilling programs,existing
applied gen ai for digital transformation mit,existing
artificial intelligence bootcamp online,existing
artificial intelligence certification,existing
artificial intelligence certification mit,existing
artificial intelligence course,existing
artificial intelligence for engineering,existing
artificial intelligence for engineers,existing
artificial intelligence for enterprise,existing
artificial intelligence for leadership,existing
artificial intelligence master online,existing
artificial intelligence master's degree online,existing
artificial intelligence ms in usa,existing
artificial intelligence online program,existing
artificial intelligence short course online,existing
artificial intelligence specialist certification,existing
artificial intelligence stanford online,existing
artificial intelligence summer course,existing
artificial intelligence training,existing
artificial intelligence workshop,existing
best ai certification,existing
best ai classes online,existing
best ai courses,existing
best ai courses 2025,existing
best ai learning course,existing
best ai ml courses for working professionals,existing
best course for artificial intelligence,existing
best course on artificial intelligence,existing
best course on generative ai,existing
best courses on artificial intelligence,existing
best courses on generative ai,existing
best generative ai course,existing
best generative ai courses,existing
best introduction to artificial intelligence,existing
best online courses for learning generative ai,existing
best place to study artificial intelligence,existing
best prompting courses,existing
bootcamp ai,existing
certification for artificial intelligence,existing
certification in machine learning and ai,existing
controllable video generation,existing
course generative ai,existing
course generator ai,existing
course in generative ai,existing
course on generative ai,existing
course on machine learning and artificial intelligence,existing
coursera generative ai,existing
courses about ai,existing
courses in generative ai,existing
courses on artificial intelligence,existing
courses on generative ai,existing
designing ai products and services,existing
designing and building ai products and services,existing
diploma in artificial intelligence,existing
driving innovation with ai,existing
driving innovation with ai mit xpro,existing
driving innovation with generative ai mit,existing
executive education ai,existing
gen ai courses,existing
genai for digital transformation,existing
generative ai certificate course,existing
generative ai certificate program,existing
generative ai certification,existing
generative ai certification online,existing
generative ai course,existing
generative ai course for business leaders,existing
generative ai course mit,existing
generative ai course online,existing
generative ai course stanford,existing
generative ai courses,existing
generative ai courses online,existing
generative ai crash course,existing
generative ai for business,existing
generative ai foundations course,existing
generative ai fundamentals,existing
generative ai fundamentals course,existing
generative ai online course,existing
generative ai online courses,existing
generative ai online program,existing
generative ai online training,existing
generative ai stanford course,existing
generative ai training course,existing
google generative ai course,existing
google's introduction to generative ai,existing
graduate certificate artificial intelligence,existing
harvard ai certificate,existing
harvard ai course,existing
introduction to generative ai,existing
large language model course,existing
learn how to program ai,existing
learn prompt engineering,existing
learning chatgpt,existing
leverage ai for business,existing
machine learning engineer training,existing
mba in ai,existing
mit,existing
mit ai certificate,existing
mit ai class,existing
mit ai course,existing
mit ai courses,existing
mit ai program,existing
mit applied generative ai,existing
mit artificial intelligence course,existing
mit generative ai,existing
mit generative ai certificate,existing
mit generative ai course,existing
mit professional development,existing
mit xpro ai,existing
mit xpro ai course,existing
mit xpro designing and building ai products and services,existing
mitx,existing
no code ai and machine learning building data science solutions,existing
northeastern university artificial intelligence,existing
online ai and ml courses,existing
online ai training courses,existing
online artificial intelligence degree,existing
online course generative ai,existing
online generative ai course,existing
professional ai certificate,existing
professional certificate in ai,existing
professional certificate program in machine learning and artificial intelligence,existing
prompt engineering course,existing
python and ai course,existing
stanford agentic ai course,existing
stanford ai certificate,existing
stanford ai course,existing
stanford ai courses,existing
stanford ai professional program,existing
stanford generative ai course,existing
stanford online artificial intelligence course,existing
top artificial intelligence certification,existing
what to study to become artificial intelligence engineer,existing
