Keyword,Origin
5 day generative ai course google,new
academy lms course content ai generator addon,new
adobe generative ai content creation course,new
adobe generative ai course,new
advanced generative ai course,new
advanced generative ai courses,new
ai and generative ai course,new
ai animation generator course,new
ai animation video generator course,new
ai art generation course,new
ai art generator course,new
ai content generation course,new
ai content generation marketing course,new
ai course content generator,new
ai course curriculum generator,new
ai course description generator,new
ai course generation,new
ai course generator,new
ai course generator free,new
ai course generator free pdf,new
ai course generator github,new
ai course generator online,new
ai course generator tool,new
ai course generators translation and localization,new
ai course name generator,new
ai course outline generator,new
ai course script generator,new
ai course title generator,new
ai course video generator,new
ai courses generator,new
ai generate course,new
ai generated course,new
ai generated courses free,new
ai generated interactive courses,new
ai generated online course site,new
ai generated online courses,new
ai generation course,new
ai generation courses,new
ai generative content microsoft course,new
ai generative course,new
ai generative course free,new
ai generative course google,new
ai generative courses,new
ai generative engine optimization course,new
ai generator course,new
ai image generation course,new
ai image generation course online,new
ai image generation courses,new
ai image generator course,new
ai image generator course free,new
ai in tourism education courses generative ai tourism,new
ai language course generator,new
ai lead generation course,new
ai mini course generator,new
ai online course generator,new
ai powered course generators,new
ai prompt generator course,new
ai systems for automatic welcome course generation,new
ai systems refine customize generated courses editing tools,new
ai tools for generating course content instructional design,new
ai training course generator,new
ai video course generator,new
ai video course generator free,new
ai video generation course,new
ai video generation course free,new
ai video generation course online,new
ai video generation courses,new
ai video generation courses online,new
ai video generator course,new
ai video generator course free,new
ai video generator course free download,new
ai video generator course online,new
ai video generator course with certificate,new
ai video generator for online courses,new
amazon courses generative ai,new
amazon free courses generative ai,new
amazon free generative ai course,new
amazon generative ai course,new
amazon generative ai course cost,new
amazon generative ai courses,new
amazon offering courses generative ai,new
amplify your communication skills with generative ai course,new
amplify your personal brand with generative ai course,new
analytics vidhya generative ai course,new
analytics vidhya generative ai course review,new
andrea deeplearning ai generative models course,new
andrew ng course on generative ai,new
andrew ng generative ai course,new
applied generative ai course,new
applied generative ai course for digital transformation,new
applied generative ai course free,new
applied generative ai course online,new
applied generative ai course pdf,new
applied generative ai for digital transformation course,new
applied generative ai free course,new
applied generative ai specialization course,new
applied generative ai specialization courses,new
are there any ai courses specifically focused on generative ai,new
are there any ai courses that focus on generative ai,new
aws generative ai course,new
aws generative ai course cost,new
aws generative ai course free,new
aws generative ai course pdf,new
aws generative ai courses,new
aws generative ai courses for beginners,new
aws generative ai essentials course,new
azure generative ai course,new
azure generative ai course cost,new
azure generative ai course free download,new
azure generative ai course pdf,new
azure openai generative ai ameerpet hyderabad course,new
berkeley generative ai course,new
best ai course generator,new
best ai course generator free,new
best ai video generator course,new
best applied generative ai course,new
best applied generative ai course for career growth,new
best applied generative ai course for working professionals,new
best applied generative ai course in us,new
best applied generative ai course online,new
best applied generative ai courses for career growth 2025,new
best certification courses for generative ai,new
best course ai generator online,new
best course for generative ai,new
best course in generative ai,new
best course to learn generative ai,new
best courses for generative ai,new
best courses for learning generative ai,new
best courses generative ai 2025,new
best courses in generative ai,new
best courses to learn generative ai,new
best data analytics and generative ai course,new
best data analytics and generative ai course for career growth,new
best data analytics and generative ai course for working professionals,new
best data analytics and generative ai course in us,new
best data analytics and generative ai course online,new
best data science and generative ai course,new
best free ai course generator,new
best free course on generative ai,new
best free generative ai course,new
best free generative ai courses,new
best free generative ai courses online,new
best generative ai and machine learning course in us,new
best generative ai certification course,new
best generative ai certification courses,new
best generative ai course coursera,new
best generative ai course for beginners,new
best generative ai course for beginners online,new
best generative ai course for designers,new
best generative ai course for developers,new
best generative ai course for product managers,new
best generative ai course for project managers,new
best generative ai course free,new
best generative ai course free microsoft,new
best generative ai course free pdf,new
best generative ai course google,new
best generative ai course in india,new
best generative ai course in the world,new
best generative ai course microsoft,new
best generative ai course on udemy,new
best generative ai course online,new
best generative ai course online certificate,new
best generative ai course online for beginners,new
best generative ai course pdf,new
best generative ai courses 2024,new
best generative ai courses 2024 2025,new
best generative ai courses 2025,new
best generative ai courses 2025 online,new
best generative ai courses beginners 2025,new
best generative ai courses coursera,new
best generative ai courses for beginners,new
best generative ai courses for beginners online,new
best generative ai courses for career growth,new
best generative ai courses for career growth 2025,new
best generative ai courses for executives,new
best generative ai courses for product managers,new
best generative ai courses for working professionals 2025,new
best generative ai courses free,new
best generative ai courses free pdf,new
best generative ai courses google,new
best generative ai courses in india,new
best generative ai courses in the us 2025,new
best generative ai courses in us,new
best generative ai courses in usa,new
best generative ai courses microsoft,new
best generative ai courses on coursera,new
best generative ai courses on udemy,new
best generative ai courses online,new
best generative ai courses online 2024,new
best generative ai courses online 2025,new
best generative ai courses online for beginners,new
best generative ai courses online free,new
best generative ai courses udemy,new
best generative ai courses udemy 2025,new
best generative ai data analytics course,new
best generative ai for developers course,new
best generative ai for finance course,new
best generative ai for marketing course,new
best generative ai for software development course,new
best generative ai learning course,new
best generative ai learning courses,new
best generative ai online course 2025,new
best generative ai online courses,new
best generative ai online courses 2025,new
best generative ai prompt engineering course,new
best generative ai udemy course 2025,new
best microsoft generative ai course github,new
best online course for generative ai,new
best online course on generative ai,new
best online courses for generative ai,new
best online courses for generative ai 2025,new
best online courses for learning generative ai 2025,new
best online courses generative ai career,new
best online courses on generative ai,new
best online generative ai course,new
best online generative ai courses,new
best paid generative ai courses,new
best paid generative ai courses 2025,new
best platforms for generative ai courses 2025,new
best udemy courses for generative ai,new
best universities for generative ai courses 2025,new
build power apps with generative ai courses,new
caltech generative ai course,new
career 247 generative ai course fee,new
certificate course in generative ai,new
certification courses on generative ai,new
certified associate generative ai llms course by nvidia,new
charlene li generative ai and workplace transformation course,new
chatgpt and generative ai course in malayalam,new
cmu generative ai course,new
complete generative ai course,new
complete generative ai course with langchain and huggingface,new
complete generative ai course with langchain and huggingface free,new
complete generative ai course with langchain and huggingface free download,new
complete generative ai course with langchain and huggingface krish naik,new
complete generative ai course with langchain and huggingface torrent,new
complete generative ai course with langchain and huggingface udemy,new
computer vision generative ai course,new
cornell generative ai course,new
course ai generator,new
course ai generator free,new
course ai generator online,new
course certificate for generative ai with large language models,new
course for generative ai,new
course generator ai free,new
course generator ai online,new
course hero ai generator,new
course on ai video generation,new
courseau ai course generator,new
coursera courses generative ai,new
coursera courses on generative ai,new
coursera free generative ai course,new
coursera generative ai course,new
coursera generative ai courses,new
coursera generative ai for everyone course,new
coursera generative ai free course,new
coursera ibm generative ai course,new
courses for generative ai,new
courses generative ai,new
courses nvidia generative ai,new
courses on ai and generative ai,new
courses that teach ai for sales and lead generation,new
crash course in ai art generation,new
create compliance courses using generative ai,new
create medical compliance courses using generative ai,new
data analytics and generative ai course,new
data analytics course with generative ai,new
data analytics with generative ai course,new
data science and generative ai course,new
data science with generative ai course,new
data science with generative ai course fees,new
data science with generative ai course free download,new
data science with generative ai course hyderabad,new
data science with generative ai course pw,new
data science with generative ai course salary,new
databricks generative ai course,new
databricks generative ai engineering course,new
databricks generative ai fundamentals course,new
datacamp generative ai course,new
deep learning ai generative ai courses,new
deep learning generative ai course,new
deeplearning ai generative ai course,new
developing generative ai applications on aws course,new
diffusion generative ai course,new
download ethics in the age of generative ai course,new
download generative ai in hr course,new
download get ready for generative ai course,new
download linkedin amplify your personal brand with generative ai course,new
download linkedin discover the possibilities of generative ai course,new
download linkedin integrating generative ai into the creative process course,new
download linkedin introduction to prompt engineering for generative ai course,new
download linkedin using generative ai ethically at work course,new
download linkedin weekly generative ai tool series course,new
download rapid idea generation using ai course,new
download using generative ai ethically at work course,new
edureka generative ai course review,new
elevate your business branding with generative ai course,new
enhancing excel with generative ai tools course,new
enhancing excel with generative ai tools online course,new
ethics in the age of generative ai course,new
ethics in the age of generative ai online course,new
feree ai course generator,new
foundational generative ai course id 80302,new
free 5 day generative ai course by google,new
free ai course content generator,new
free ai course generator,new
free ai course generator online,new
free ai course generator with certificate,new
free ai generative course,new
free ai generative prompt writing courses online no fees,new
free ai video generation course,new
free ai video generator course,new
free certification courses generative ai,new
free certification courses on generative ai,new
free course ai video generation,new
free course generative ai,new
free course generator ai,new
free course on generative ai,new
free courses ai video generation,new
free courses for generative ai,new
free courses generative ai,new
free courses in generative ai,new
free courses on generative ai,new
free generative ai certification course,new
free generative ai course,new
free generative ai course by microsoft,new
free generative ai course google,new
free generative ai course with certificate,new
free generative ai course with certificate online,new
free generative ai courses,new
free generative ai courses by google,new
free generative ai courses google,new
free generative ai courses with certificates,new
free generative ai prompt engineering course,new
free google courses on generative ai,new
free google generative ai course,new
free microsoft generative ai course,new
free online course on generative ai,new
free online courses generative ai,new
free online courses on generative ai,new
free online generative ai courses,new
gcp generative ai course,new
generate ai course,new
generate ai free course with certificate,new
generate course with ai,new
generate courses using ai,new
generate courses with ai,new
generated ai course,new
generating ai course,new
generation ai course,new
generation ai course with realworld project,new
generative ai 101 learning course,new
generative ai advanced course,new
generative ai agent course,new
generative ai agents course,new
generative ai ameerpet course,new
generative ai ameerpet hyderabad course,new
generative ai and agentic ai course,new
generative ai and agentic ai courses,new
generative ai and llm course,new
generative ai and machine learning course,new
generative ai and ml course,new
generative ai and prompt engineering course,new
generative ai and workplace transformation course,new
generative ai applications course,new
generative ai architect course,new
generative ai at sap course,new
generative ai at sap course assignment answers,new
generative ai automation course,new
generative ai aws course,new
generative ai basic course,new
generative ai beginner course,new
generative ai beginner course free,new
generative ai best course,new
generative ai best courses,new
generative ai bootcamp course in mumbai,new
generative ai by google course,new
generative ai certification course,new
generative ai certification courses,new
generative ai chatgpt course,new
generative ai complete course,new
generative ai content creation course,new
generative ai course 2025,new
generative ai course and certification,new
generative ai course andrew ng,new
generative ai course answers,new
generative ai course aws,new
generative ai course azure,new
generative ai course azure free,new
generative ai course azure online,new
generative ai course azure pdf,new
generative ai course bangalore,new
generative ai course benefits,new
generative ai course by google,new
generative ai course by google cloud,new
generative ai course by microsoft,new
generative ai course by microsoft pdf,new
generative ai course by nvidia,new
generative ai course certificate,new
generative ai course certificate free,new
generative ai course certification,new
generative ai course content,new
generative ai course coursera,new
generative ai course curriculum,new
generative ai course deep learning,new
generative ai course details,new
generative ai course eligibility,new
generative ai course fees,new
generative ai course fees in india,new
generative ai course for beginners,new
generative ai course for beginners online,new
generative ai course for business analyst,new
generative ai course for designers,new
generative ai course for developers,new
generative ai course for digital marketing,new
generative ai course for executives,new
generative ai course for free,new
generative ai course for hr,new
generative ai course for java developers,new
generative ai course for kids,new
generative ai course for lawyers,new
generative ai course for leaders,new
generative ai course for managers,new
generative ai course for non it background,new
generative ai course for non technical,new
generative ai course for product managers,new
generative ai course for project managers,new
generative ai course for testers,new
generative ai course free,new
generative ai course free by google,new
generative ai course free google,new
generative ai course free microsoft,new
generative ai course free microsoft download,new
generative ai course free online,new
generative ai course free with certificate,new
generative ai course free with certificate online,new
generative ai course from google,new
generative ai course google,new
generative ai course google cloud,new
generative ai course google free,new
generative ai course great learning,new
generative ai course harvard,new
generative ai course hyderabad,new
generative ai course ibm,new
generative ai course iit,new
generative ai course iit madras,new
generative ai course in ameerpet hyderabad,new
generative ai course in bangalore,new
generative ai course in chennai,new
generative ai course in coursera,new
generative ai course in hindi,new
generative ai course in hyderabad,new
generative ai course in india,new
generative ai course in mumbai,new
generative ai course in pune,new
generative ai course in singapore,new
generative ai course in software testing and documentation,new
generative ai course in udemy,new
generative ai course india,new
generative ai course linkedin,new
generative ai course london,new
generative ai course microsoft,new
generative ai course microsoft pdf,new
generative ai course mit review,new
generative ai course model building deployment,new
generative ai course modules,new
generative ai course near me,new
generative ai course nptel,new
generative ai course nvidia,new
generative ai course nvidia online,new
generative ai course online free,new
generative ai course online india,new
generative ai course online with certificate,new
generative ai course outline,new
generative ai course overview,new
generative ai course pdf,new
generative ai course prerequisites,new
generative ai course price,new
generative ai course questions and answers,new
generative ai course roadmap,new
generative ai course session hyderabad,new
generative ai course simplilearn,new
generative ai course singapore,new
generative ai course singapore online,new
generative ai course skillsfuture,new
generative ai course structure,new
generative ai course syllabus,new
generative ai course syllabus pdf,new
generative ai course topics,new
generative ai course udemy,new
generative ai course uk,new
generative ai course university,new
generative ai course with certificate,new
generative ai course with certificate free,new
generative ai course with certification,new
generative ai course with job guarantee,new
generative ai course with langchain and hugging,new
generative ai course with placement,new
generative ai course with projects,new
generative ai coursera course,new
generative ai courses 2025,new
generative ai courses and certifications,new
generative ai courses andrew ng,new
generative ai courses by amazon,new
generative ai courses by google,new
generative ai courses coursera,new
generative ai courses edx reviews,new
generative ai courses for beginners,new
generative ai courses for business leaders,new
generative ai courses for developers,new
generative ai courses for managers,new
generative ai courses for marketing professionals,new
generative ai courses for product managers,new
generative ai courses for project managers,new
generative ai courses for teachers,new
generative ai courses free,new
generative ai courses free with certificate,new
generative ai courses google,new
generative ai courses google certification,new
generative ai courses hyderabad,new
generative ai courses in bangalore,new
generative ai courses in hyderabad,new
generative ai courses in india,new
generative ai courses india,new
generative ai courses london,new
generative ai courses microsoft,new
generative ai courses microsoft online,new
generative ai courses near me,new
generative ai courses online for beginners,new
generative ai courses see notes,new
generative ai courses singapore,new
generative ai courses udemy,new
generative ai courses with certification,new
generative ai cybersecurity course,new
generative ai cybersecurity course online,new
generative ai data analytics course,new
generative ai data analytics course free,new
generative ai data analytics course online,new
generative ai design course,new
generative ai developer course,new
generative ai development course,new
generative ai engineer course,new
generative ai engineering course,new
generative ai engineering with databricks course,new
generative ai executive course,new
generative ai explained nvidia course,new
generative ai explained nvidia course answers,new
generative ai explained nvidia free course,new
generative ai finance course,new
generative ai for agile leaders course,new
generative ai for agile leaders course training,new
generative ai for art course,new
generative ai for beginners course,new
generative ai for beginners free course,new
generative ai for beginners microsoft course,new
generative ai for business course,new
generative ai for business course online,new
generative ai for business free course,new
generative ai for business leaders course,new
generative ai for business leaders course free,new
generative ai for business leaders course online,new
generative ai for business leaders online course,new
generative ai for business transformation course,new
generative ai for creative professionals course,new
generative ai for cybersecurity course,new
generative ai for data analytics course,new
generative ai for data engineering course,new
generative ai for design course,new
generative ai for designers course,new
generative ai for developers course,new
generative ai for devops course,new
generative ai for educators course,new
generative ai for everyone course,new
generative ai for everyone free course,new
generative ai for filmmaking course,new
generative ai for finance course,new
generative ai for gaming course,new
generative ai for health courses,new
generative ai for healthcare course,new
generative ai for hr course,new
generative ai for kids course,new
generative ai for leaders certification course,new
generative ai for leaders course,new
generative ai for marketing course,new
generative ai for marketing course free,new
generative ai for marketing course online,new
generative ai for marketing courses,new
generative ai for product managers course,new
generative ai for product managers free course,new
generative ai for project managers course,new
generative ai for project managers elearning course,new
generative ai for project managers free course,new
generative ai for sales courses,new
generative ai for scrum master course,new
generative ai for software developers course,new
generative ai for software development course,new
generative ai for software development free course,new
generative ai for software testing course,new
generative ai for software testing course online,new
generative ai for testers course,new
generative ai free certification course,new
generative ai free course,new
generative ai free course by google,new
generative ai free course by microsoft,new
generative ai free course with certificate,new
generative ai free course with certificate by google,new
generative ai free courses,new
generative ai free courses by google,new
generative ai free courses with certificate,new
generative ai free online course,new
generative ai from scratch python course,new
generative ai full course,new
generative ai full course free,new
generative ai full course free with certificate,new
generative ai full course pdf,new
generative ai full course syllabus,new
generative ai fundamentals by databricks free course,new
generative ai gcp course,new
generative ai google course,new
generative ai google courses,new
generative ai google free course,new
generative ai hands on course,new
generative ai harvard course,new
generative ai healthcare course,new
generative ai ibm course,new
generative ai in business course,new
generative ai in business course online,new
generative ai in education courses,new
generative ai in finance course,new
generative ai in healthcare courses,new
generative ai in hr certification course,new
generative ai in hr course,new
generative ai in hr course free,new
generative ai in hr free course,new
generative ai in marketing course,new
generative ai in retail certification course,new
generative ai in retail training course,new
generative ai in software testing course,new
generative ai in supply chain course,new
generative ai in supply chain management course,new
